{
  "version": "1.1.0",
  "diagramType": "sequence",
  "title": "GET /reports/daily/{status}",
  "subtitle": "GET /reports/daily/{status} — today's total for one payment status.",
  "theme": "editorial-light",
  "metadata": {
    "targetRepo": "/tmp/polyglot-shop",
    "generatedAt": "unversioned",
    "visualDensityScore": 0.075
  },
  "containers": [],
  "nodes": [
    {
      "id": "client",
      "label": "Client",
      "isKeyFocalPoint": false
    },
    {
      "id": "ledger-audit",
      "label": "Ledger Audit",
      "techStack": "Rust · Axum",
      "isKeyFocalPoint": true,
      "evidence": {
        "filePath": "ledger-audit/src/main.rs",
        "startLine": 10,
        "endLine": 21,
        "symbolName": "main"
      }
    },
    {
      "id": "postgres",
      "label": "PostgreSQL",
      "isKeyFocalPoint": false,
      "evidence": {
        "filePath": "api-gateway/src/db.ts",
        "startLine": 1,
        "endLine": 1
      }
    }
  ],
  "edges": [
    {
      "id": "m1",
      "source": "client",
      "target": "ledger-audit",
      "label": "GET /reports/daily/{status}",
      "edgeType": "sync",
      "isPrimaryPath": true,
      "sequence": 1,
      "evidence": {
        "filePath": "ledger-audit/src/routes.rs",
        "startLine": 23,
        "endLine": 23
      }
    },
    {
      "id": "m2",
      "source": "ledger-audit",
      "target": "postgres",
      "label": "read payments",
      "edgeType": "read",
      "sequence": 2,
      "evidence": {
        "filePath": "ledger-audit/src/audit.rs",
        "startLine": 17,
        "endLine": 17
      }
    },
    {
      "id": "m3",
      "source": "ledger-audit",
      "target": "client",
      "label": "200 DailyTotal",
      "edgeType": "sync",
      "isPrimaryPath": true,
      "sequence": 3,
      "reply": true,
      "evidence": {
        "filePath": "ledger-audit/src/routes.rs",
        "startLine": 43,
        "endLine": 46,
        "symbolName": "daily_status"
      }
    }
  ]
}
